ndb_id,food_name,serving_unit,serving_size_grams,source_file,categories,total_nutrients
R214002,"TRADITIONAL MALAYSIAN KUIH, GLUTINOUS RICE BALLS IN COCONUT MILK (BADAK BERENDAM)",1 piece,38.72,R214002.json,"[""Proximates""]",6
R214006,"TRADITIONAL MALAYSIAN KUIH, GLUTINOUS RICE FLOUR AND COCONUT MILK BASED, BOILED PALM SUGAR TOFFEE-LIKE SWEET (DODOL)",1 piece,15.68,R214006.json,"[""Proximates""]",6
R214010,"TRADITIONAL MALAYSIAN KUIH, SESAME BALLS (KUIH BOM)",1 piece,33.48,R214010.json,"[""Proximates""]",13
R214016,"TRADITIONAL MALAYSIAN KUIH, SWEET BLACK GLUTINOUS RICE DUMPLING STUFFED WITH GRATED COCONUT FILLING (KUIH KOCI PULUT HITAM)",1 piece,35.81,R214016.json,"[""Proximates""]",6
R214032,"TRADITIONAL MALAYSIAN KUIH, SWEET FERMENTED GLUTINOUS RICE (TAPAI PULUT)",1 piece,26.76,R214032.json,"[""Proximates""]",6
R214034,"TRADITIONAL MALAYSIAN KUIH, GLUTINUOS RICE FLOUR BASED STUFFED WITH GRATED COCONUT COATED WITH MUNG BEAN POWDER (KUIH TEPUNG GOMAK)",1 piece,48.82,R214034.json,"[""Proximates""]",6
R215003,CAKAR AYAM,1 piece,37.5,R215003.json,"[""Proximates"", ""Minerals""]",10
R215004,KELEDEK GORENG,1 piece,8.0,R215004.json,"[""Proximates"", ""Minerals""]",8
R216012,SAMOSA,1 piece,29.5,R216012.json,"[""Proximates"", ""Minerals""]",8
R217005,"DESSERT, COCONUT MILK BASED, SWEET POTATOES AND TARO IN COCONUT MILK (BUBUR CHA CHA)",1 BOWL,334.33,R217005.json,"[""Proximates""]",13
R217007,"DESSERT, CORN IN SWEETENED COCONUT MILK (BUBUR JAGUNG)",1 BOWL,342.21,R217007.json,"[""Proximates""]",13
R217021,"DESSERT, BLACK GLUTINOUS RICE PORRIDGE (BUBUR PULUT HITAM)",1 BOWL,396.96,R217021.json,"[""Proximates""]",13
R217022,"DESSERT, SAGO PORRIDGE (BUBUR SAGU)",1 BOWL,371.07,R217022.json,"[""Proximates""]",13
R218004,"DESEERT, COCONUT MILK JELLY (AGAR-AGAR SANTAN)",1 slice,38.09,R218004.json,"[""Proximates""]",6
R218007,"DESSERT , CARAMEL PUDDING",1 slice,36.89,R218007.json,"[""Proximates""]",6
R218011,"CREAM ROLL, VANILLA FLAVOUR",1 piece,40.13,R218011.json,"[""Proximates""]",13
R218019,"TRADITIONAL MALAYSIAN KUIH, COCONUT CREAM COOKIES (KUIH BANGKIT)",1 piece,2.61,R218019.json,"[""Proximates""]",6
R218023,"TRADITIONAL MALAYSIAN KUIH, FLOUR BASED, WITH RED PALM SUGAR  (KUIH CINCIN)",Unknown serving,,R218023.json,"[""Proximates""]",10
R218036,"DESSERT, BREAD PUDDING",1 SLICE,132.68,R218036.json,"[""Proximates""]",6
R218037,"DESSERT, PUDDING, MILK (PUDING SUSU)",1 piece,39.06,R218037.json,"[""Proximates""]",13
R218048,"DESSERT, BROWNIES, CHOCOLATE",1 piece,20.68,R218048.json,"[""Proximates""]",6
R218049,"DESSERT, CHEESE TART",1 piece,14.92,R218049.json,"[""Proximates""]",6
R218050,"DESSERT, SHAVED ICE, ABC (AIR BATU CAMPUR/AIS KACANG)",1 BOWL,250.0,R218050.json,"[""Proximates""]",6
R218051,"DOUGHNUT, WITH FROSTING/GLAZE (DONUT)",Unknown serving,,R218051.json,"[""Proximates""]",6
R218052,"DESSERT, SOY MILK CUSTARD (TAUFU-FAH)",1 BOWL,297.37,R218052.json,"[""Proximates""]",11
R221079,"RICE, ""DAGANG"" (NASI DAGANG)(COMPLETE SET)",1 set,214.0,R221079.json,"[""Proximates""]",13
R221081,"RICE, ARAB (NASI ARAB)",1 cup,117.46,R221081.json,"[""Proximates""]",13
R221083,"RICE, BRIYANI (RICE ONLY) (BASMATHI RICE)",1 cup,116.11,R221083.json,"[""Proximates""]",13
R221088,"RICE, KERABU (NASI KERABU)(COMPLETE SET)",1 set,168.47,R221088.json,"[""Proximates""]",13
R221107,"RICE, BRIYANI (AYAM)",1 set,404.76,R221107.json,"[""Proximates""]",13
R221108,"RICE, BRIYANI (DAGING)",1 set,271.62,R221108.json,"[""Proximates""]",13
R221109,NASI ARAB SET KHABSYAH (KAMBING),1 set,319.63,R221109.json,"[""Proximates""]",13
R221110,NASI ARAB SET MANDY (AYAM),1 set,468.26,R221110.json,"[""Proximates""]",13
R221113,"RICE, ""DAGANG"" (NASI DAGANG)(RICE ONLY)",1 cup,115.1,R221113.json,"[""Proximates""]",13
R222004,BEEF RENDANG (RENDANG DAGING LEMBU),1 bowl,293.15,R222004.json,"[""Proximates""]",13
R222008,"BEEF, FLOSS (SERUNDING DAGING)",1 bowl,35.4,R222008.json,"[""Proximates""]",11
R222022,CHICKEN CHOP (BELAHAN AYAM TANPA TULANG),1 piece,172.8,R222022.json,"[""Proximates""]",13
R222029,CHICKEN SATAY (SATAY AYAM),1 stick,16.99,R222029.json,"[""Proximates""]",13
R223003,"ANCHOVY, DRIED, FRIED IN CHILLI (IKAN BILIS SAMBAL)",1/2 cup,40.0,R223003.json,"[""Proximates""]",13
R223015,"CATFISH, FRIED IN CHILLI (IKAN KELI GORENG BERLADA)",1 whole,174.64,R223015.json,"[""Proximates""]",13
R223019,"COCKLES, BOILED (KERANG REBUS)",Unknown serving,,R223019.json,"[""Proximates""]",13
R223027,"CRAB, IN COCONUT MILK (KETAM MASAK LEMAK CILI API)",1 whole,121.7,R223027.json,"[""Proximates""]",13
R223030,"CUTTLEFISH, DRIED, FRIED IN CHILLI (SAMBAL SOTONG KERING)",1 bowl,290.5,R223030.json,"[""Proximates""]",13
R223080,"STINGRAY, COOKED IN TAMARIND (IKAN PARI MASAK ASAM PEDAS)",1 piece,108.98,R223080.json,"[""Proximates""]",13
R224014,"CABBAGE, FRIED (KOBIS GORENG)",1 cup,145.62,R224014.json,"[""Proximates""]",13
R224026,KALE WITH SALTED FISH (KAILAN IKAN MASIN),1 cup,121.67,R224026.json,"[""Proximates""]",13
R224034,"MIX VEGETABLES, STIR FRIED (SAYUR CAMPUR GORENG)",1 cup,164.3,R224034.json,"[""Proximates""]",13
R224046,"SPINACH, (BAYAM MASAK AIR)",Unknown serving,,R224046.json,"[""Proximates""]",13
R224048,"SWAMP CABBAGE, FRIED WITH BELACAN (KANGKUNG GORENG BELACAN)",1 cup,142.7,R224048.json,"[""Proximates""]",13
R224049,"TRADITIONAL MALAYSIAN KUIH, SWEET FERMENTED TAPIOCA (TAPAI UBI KAYU)",1 bowl,272.26,R224049.json,"[""Proximates""]",13
R225015,ROJAK PASTE,1 tablespoon,23.13,R225015.json,"[""Proximates""]",6
R225024,"COFFEE, WITH MILK AND SUGAR, FROM MAMAK STALLS",1 cup,,R225024.json,"[""Proximates""]",12
R237013,"PEARL MILK TEA (WITH BREWED TEA, MILK, SUGAR SYRUP, TAPIOCA PEARLS), NORMAL SUGAR",1 cup,,R237013.json,"[""Proximates""]",6
R237014,"ICE CHOCHOLATE BLENDED, WITH WHIPPING CREAM",Unknown serving,,R237014.json,"[""Proximates""]",13
